{
  "cells": [
    {
      "audit": {
        "document_chunks": {
          "batch_sizes_used": [
            8
          ],
          "count": 7500,
          "cpu_time_s": 164.7423991849999,
          "latency_ms": 44774.860894307494,
          "max_observed_tokens": 8421,
          "peak_ram_bytes": 3993358336,
          "peak_vram_bytes": 1248534016,
          "tokenizer_classes": [
            "XLMRobertaTokenizer"
          ],
          "truncated_count": 711
        },
        "exact_search_s": 0.8319750502705574,
        "query": {
          "batch_size_requested": 8,
          "batch_size_used": 8,
          "count": 103,
          "cpu_time_s": 2.3475706419999938,
          "latency_ms": 648.4074480831623,
          "max_observed_tokens": 539,
          "peak_ram_bytes": 3993358336,
          "peak_vram_bytes": 1247239680,
          "pruning_max_active_dims": null,
          "tokenizer_class": "XLMRobertaTokenizer",
          "truncated_count": 2
        }
      },
      "confidence_intervals": {
        "map@100": {
          "high": 0.27001884429108436,
          "low": 0.16422220803514795,
          "mean": 0.215270409574903,
          "samples": 10000,
          "seed": 20260826
        },
        "mrr@10": {
          "high": 0.40174921020188026,
          "low": 0.25224967252273073,
          "mean": 0.32577824009862844,
          "samples": 10000,
          "seed": 20260826
        },
        "ndcg@10": {
          "high": 0.3456919831505383,
          "low": 0.21836347141731036,
          "mean": 0.2806269377375966,
          "samples": 10000,
          "seed": 20260826
        },
        "recall@10": {
          "high": 0.3955184820667703,
          "low": 0.24463369611338995,
          "mean": 0.3184928701849075,
          "samples": 10000,
          "seed": 20260826
        },
        "recall@100": {
          "high": 0.7251315334862519,
          "low": 0.5816321981595575,
          "mean": 0.6543185531218194,
          "samples": 10000,
          "seed": 20260826
        }
      },
      "counts": {
        "documents": 7500,
        "qrels": 800,
        "queries": 103
      },
      "document_route": "neural",
      "license": "MIT",
      "mechanism": "contextual lexical token-weight projection with max pooling",
      "metrics": {
        "map@100": 0.21527040957490312,
        "mrr@10": 0.32577824009862844,
        "ndcg@10": 0.2806269377375966,
        "recall@10": 0.3184928701849075,
        "recall@100": 0.6543185531218195
      },
      "model_key": "bge-m3",
      "nnz": {
        "documents": {
          "count": 7500,
          "empty": 0,
          "max": 294,
          "mean": 51.46026666666667,
          "p50": 34.0,
          "p95": 174.0,
          "total": 385952
        },
        "queries": {
          "count": 103,
          "empty": 0,
          "max": 161,
          "mean": 64.27184466019418,
          "p50": 59.0,
          "p95": 115.59999999999997,
          "total": 6620
        }
      },
      "query_route": "neural",
      "repo_id": "BAAI/bge-m3",
      "revision": "5617a9f61b028005a4858fdac845db406aefb181",
      "search": {
        "backend": "scipy_csr_exact",
        "exact": true,
        "tie_break": "document_id_ascending",
        "top_k": 100
      },
      "snapshot_identity_sha256": "b74878c8ce0438f0cefe3d3422e699507bc1ba04cf9c59f0615f77fd3224a2d0",
      "track": "economics",
      "training_overlap_boundary": "Training overlap with BRIGHT source material is not ruled out; results must not be described as zero-shot."
    },
    {
      "audit": {
        "document_chunks": {
          "batch_sizes_used": [
            8
          ],
          "count": 7500,
          "cpu_time_s": 162.22376329400004,
          "latency_ms": 43797.447269782424,
          "max_observed_tokens": 81252,
          "peak_ram_bytes": 3963809792,
          "peak_vram_bytes": 1248157184,
          "tokenizer_classes": [
            "XLMRobertaTokenizer"
          ],
          "truncated_count": 425
        },
        "exact_search_s": 0.7680287379771471,
        "query": {
          "batch_size_requested": 8,
          "batch_size_used": 8,
          "count": 101,
          "cpu_time_s": 2.1097684709999953,
          "latency_ms": 582.9007979482412,
          "max_observed_tokens": 508,
          "peak_ram_bytes": 3963809792,
          "peak_vram_bytes": 1246514688,
          "pruning_max_active_dims": null,
          "tokenizer_class": "XLMRobertaTokenizer",
          "truncated_count": 0
        }
      },
      "confidence_intervals": {
        "map@100": {
          "high": 0.34934959369017193,
          "low": 0.21130776865456957,
          "mean": 0.2773825879223076,
          "samples": 10000,
          "seed": 20260826
        },
        "mrr@10": {
          "high": 0.47777286657237156,
          "low": 0.3095287207292157,
          "mean": 0.3916863114882917,
          "samples": 10000,
          "seed": 20260826
        },
        "ndcg@10": {
          "high": 0.397573835525951,
          "low": 0.2516799288478224,
          "mean": 0.32266363940032183,
          "samples": 10000,
          "seed": 20260826
        },
        "recall@10": {
          "high": 0.41413098305533425,
          "low": 0.260142917344083,
          "mean": 0.33531673549620644,
          "samples": 10000,
          "seed": 20260826
        },
        "recall@100": {
          "high": 0.6875130336962861,
          "low": 0.5309782841044329,
          "mean": 0.6108259628077215,
          "samples": 10000,
          "seed": 20260826
        }
      },
      "counts": {
        "documents": 7500,
        "qrels": 692,
        "queries": 101
      },
      "document_route": "neural",
      "license": "MIT",
      "mechanism": "contextual lexical token-weight projection with max pooling",
      "metrics": {
        "map@100": 0.2773825879223076,
        "mrr@10": 0.3916863114882917,
        "ndcg@10": 0.3226636394003219,
        "recall@10": 0.33531673549620633,
        "recall@100": 0.6108259628077215
      },
      "model_key": "bge-m3",
      "nnz": {
        "documents": {
          "count": 7500,
          "empty": 0,
          "max": 275,
          "mean": 47.8748,
          "p50": 33.0,
          "p95": 152.0,
          "total": 359061
        },
        "queries": {
          "count": 101,
          "empty": 0,
          "max": 153,
          "mean": 59.722772277227726,
          "p50": 55.0,
          "p95": 103.0,
          "total": 6032
        }
      },
      "query_route": "neural",
      "repo_id": "BAAI/bge-m3",
      "revision": "5617a9f61b028005a4858fdac845db406aefb181",
      "search": {
        "backend": "scipy_csr_exact",
        "exact": true,
        "tie_break": "document_id_ascending",
        "top_k": 100
      },
      "snapshot_identity_sha256": "b74878c8ce0438f0cefe3d3422e699507bc1ba04cf9c59f0615f77fd3224a2d0",
      "track": "psychology",
      "training_overlap_boundary": "Training overlap with BRIGHT source material is not ruled out; results must not be described as zero-shot."
    },
    {
      "audit": {
        "document_chunks": {
          "batch_sizes_used": [
            8
          ],
          "count": 7500,
          "cpu_time_s": 115.67931609899995,
          "latency_ms": 14607.105363160372,
          "max_observed_tokens": 8406,
          "peak_ram_bytes": 1889099776,
          "peak_vram_bytes": 898789888,
          "tokenizer_classes": [
            "RobertaTokenizer"
          ],
          "truncated_count": 748
        },
        "exact_search_s": 0.8694914001971483,
        "query": {
          "batch_size_requested": 8,
          "batch_size_used": 8,
          "count": 103,
          "cpu_time_s": 1.565255762999982,
          "latency_ms": 234.4100195914507,
          "max_observed_tokens": 711,
          "peak_ram_bytes": 1952841728,
          "peak_vram_bytes": 898789888,
          "pruning_max_active_dims": 50,
          "tokenizer_class": "RobertaTokenizer",
          "truncated_count": 2
        }
      },
      "confidence_intervals": {
        "map@100": {
          "high": 0.26157627159968094,
          "low": 0.15663088647564594,
          "mean": 0.20709281063904442,
          "samples": 10000,
          "seed": 20260826
        },
        "mrr@10": {
          "high": 0.3698385729696408,
          "low": 0.22069617814763448,
          "mean": 0.2932963476652797,
          "samples": 10000,
          "seed": 20260826
        },
        "ndcg@10": {
          "high": 0.32386934512668586,
          "low": 0.1988561963192649,
          "mean": 0.2595328092636765,
          "samples": 10000,
          "seed": 20260826
        },
        "recall@10": {
          "high": 0.37089914881978625,
          "low": 0.2245637923629153,
          "mean": 0.2952049380383892,
          "samples": 10000,
          "seed": 20260826
        },
        "recall@100": {
          "high": 0.7485537390433634,
          "low": 0.6013131948649295,
          "mean": 0.6767143776183396,
          "samples": 10000,
          "seed": 20260826
        }
      },
      "counts": {
        "documents": 7500,
        "qrels": 800,
        "queries": 103
      },
      "document_route": "neural",
      "license": "Apache-2.0",
      "mechanism": "neural SPLADE masked-language-model expansion with role-specific top-k pruning",
      "metrics": {
        "map@100": 0.2070928106390444,
        "mrr@10": 0.2932963476652797,
        "ndcg@10": 0.25953280926367644,
        "recall@10": 0.2952049380383892,
        "recall@100": 0.6767143776183396
      },
      "model_key": "granite-30m-sparse",
      "nnz": {
        "documents": {
          "count": 7500,
          "empty": 0,
          "max": 192,
          "mean": 163.3032,
          "p50": 192.0,
          "p95": 192.0,
          "total": 1224774
        },
        "queries": {
          "count": 103,
          "empty": 0,
          "max": 50,
          "mean": 50.0,
          "p50": 50.0,